{"$schema":"https://json-schema.org/draft/2020-12/schema","title":"RenderJob","type":"object","required":["provider","input_ref","output"],"properties":{"provider":{"enum":["remotion","hyperframes","html-motion","threejs","blender","unreal","custom"]},"input_ref":{"type":"string"},"composition":{"type":"string"},"output":{"type":"object","required":["format","width","height","fps"],"properties":{"format":{"enum":["mp4","webm","gif","png-sequence","project"]},"width":{"type":"integer"},"height":{"type":"integer"},"fps":{"type":"number"},"codec":{"type":"string"},"audio_codec":{"type":"string"}}},"assets":{"type":"array","items":{"type":"string"}},"fonts":{"type":"array","items":{"type":"string"}},"subtitles":{"type":"array","items":{"type":"object"}},"quality_profile":{"type":"string"},"status":{"enum":["planned","compiling","rendering","validating","done","failed","unknown"]}}}